{
  "caveats": [
    "This is a frozen source bundle, not a live or current lookup."
  ],
  "claim_register": [
    {
      "claim": "Bookings open 90 days before the permit date.",
      "claim_id": "booking-window",
      "source_id": "rulebook-2026"
    },
    {
      "claim": "Gas stoves are prohibited during a declared total fire ban.",
      "claim_id": "fire-ban",
      "source_id": "rulebook-2026"
    },
    {
      "claim": "The north track is closed through 2026-06-15.",
      "claim_id": "north-track-closure",
      "source_id": "park-alert-2026-06"
    }
  ],
  "conflicts": [
    "The alert narrows the general rulebook scope for the north track through 2026-06-15."
  ],
  "recommendation": "Plan bookings from the 90-day window and avoid the north track through 2026-06-15; check the fire-ban rule before departure.",
  "scope_and_dates": "These claims apply to Coastal Ridge Park and the supplied 2026 source dates.",
  "source_links": [
    {
      "claim_id": "booking-window",
      "source_id": "rulebook-2026"
    },
    {
      "claim_id": "fire-ban",
      "source_id": "rulebook-2026"
    },
    {
      "claim_id": "north-track-closure",
      "source_id": "park-alert-2026-06"
    }
  ]
}
